{
  "$schema": "https://json-schema.org/draft/2020-12/schema",
  "title": "CS2 semantic work projection",
  "type": "object",
  "required": ["workKey", "subject", "source", "objective", "acceptance", "falsifier", "nextEdge", "authority"],
  "properties": {
    "workKey": {"type": "string", "pattern": "^CS2-WRK-[0-9]+$"},
    "subject": {"const": "https://chatman.ai/cs2#RFC-CS2-001"},
    "source": {
      "type": "object",
      "required": ["repo", "sha", "digest"],
      "properties": {
        "repo": {"type": "string", "pattern": "^[A-Za-z0-9_.-]+/[A-Za-z0-9_.-]+$"},
        "sha": {"type": "string", "pattern": "^[0-9a-f]{40}$"},
        "digest": {"type": "string", "pattern": "^[0-9a-f]{64}$"}
      },
      "additionalProperties": false
    },
    "objective": {"type": "string", "minLength": 1},
    "acceptance": {"type": "string", "minLength": 1},
    "falsifier": {"type": "string", "minLength": 1},
    "nextEdge": {"type": "string", "minLength": 1},
    "authority": {"const": "NONE"}
  },
  "additionalProperties": false
}
