{"workKey":"CS2-WRK-003","subject":"https://chatman.ai/cs2#RFC-CS2-001","source":{"repo":"seanchatmangpt/ggen-marketplace","sha":"b0762c34b0ccd093587e0241212dbe801c9dbc3e","digest":"aaaaaaaaaaaaaaaaaaaaaaaaaaaaaaaaaaaaaaaaaaaaaaaaaaaaaaaaaaaaaaaa"},"objective":"Publish pinned reusable CS2 pack.","acceptance":"Distribute exact-root projections bound to source SHA/digest.","falsifier":"A consumer uses a divergent CS2 subject.","nextEdge":"Generate authority-free consumer adapter.","authority":"NONE"}
